{
  "id": "rp-2026-05-18-090000-prod-app-01",
  "job_id": "job-9f3c2a1e",
  "provider": "Veeam",
  "source": {
    "id": "vm-prod-app-01",
    "name": "prod-app-01",
    "type": "vm"
  },
  "created_at": "2026-05-18T09:42:11Z",
  "expires_at": "2026-06-17T09:42:11Z",
  "type": "incremental",
  "size_bytes": 18473918463,
  "logical_size_bytes": 184739184639,
  "storage_target": {
    "type": "object-storage",
    "name": "Backblaze B2 - backups-prod",
    "location": "us-west-002"
  },
  "immutable_until": "2026-06-17T09:42:11Z",
  "encryption": {
    "encrypted": true,
    "algorithm": "AES-256",
    "key_id": "kms-key-2f9a"
  },
  "verified": true,
  "tags": ["production", "monthly", "ransomware-protected"]
}
